{
  "agent": "AG03",
  "model": "sonnet",
  "target": "CH18",
  "persona_ack": "타 언어(Java/C# 계열) 백엔드 3~5년차 개발자 페르소나로 CH18(Modern ABAP Syntax) 11개 레슨 + _chapter.md를 통독했다. 프로그래밍 기본기는 이미 아는 독자 시점에서 과잉 설명·오개념 유발·지름길 부재·용어 충돌을 표시했다.",
  "method": "content/abap/CH18/_chapter.md 및 CH18-L01~L11.md 12개 파일을 Read 도구로 전문 통독(브라우저·빌드 도구 미사용, 정적 텍스트 검토).",
  "errors": [],
  "files_read": [
    "C:\\SAP\\sap-dev-academy\\content\\abap\\CH18\\_chapter.md",
    "C:\\SAP\\sap-dev-academy\\content\\abap\\CH18\\CH18-L01.md",
    "C:\\SAP\\sap-dev-academy\\content\\abap\\CH18\\CH18-L02.md",
    "C:\\SAP\\sap-dev-academy\\content\\abap\\CH18\\CH18-L03.md",
    "C:\\SAP\\sap-dev-academy\\content\\abap\\CH18\\CH18-L04.md",
    "C:\\SAP\\sap-dev-academy\\content\\abap\\CH18\\CH18-L05.md",
    "C:\\SAP\\sap-dev-academy\\content\\abap\\CH18\\CH18-L06.md",
    "C:\\SAP\\sap-dev-academy\\content\\abap\\CH18\\CH18-L07.md",
    "C:\\SAP\\sap-dev-academy\\content\\abap\\CH18\\CH18-L08.md",
    "C:\\SAP\\sap-dev-academy\\content\\abap\\CH18\\CH18-L09.md",
    "C:\\SAP\\sap-dev-academy\\content\\abap\\CH18\\CH18-L10.md",
    "C:\\SAP\\sap-dev-academy\\content\\abap\\CH18\\CH18-L11.md"
  ],
  "findings": [
    {
      "seq": 1,
      "file": "content/abap/CH18/CH18-L06.md",
      "quote": "DATA(lv_seats) = CONV i( '3.7' ).   \" 4 — 0.3의 손실(반올림)을 감수하고 변환",
      "category": "오개념 유발",
      "severity": "중간",
      "confidence": "확실",
      "claim": "CONV로 소수 문자열을 정수로 바꿀 때 '반올림'된다는 사실만 제시하고, Java/C# 개발자가 상식으로 아는 '숫자→정수 캐스팅은 버림(truncate)'과 다르다는 대조가 없다. 같은 챕터 L10의 정수 나눗셈 대목에서는 \"소수점은 버린다가 기본인 다른 언어와 달라 조용한 계산 차이를 만드는 지점\"이라고 명시적으로 대조해 주는데, 성격이 똑같은 CONV의 반올림에는 그 대조가 빠져 있어 형평이 맞지 않고, 경력자가 '반올림'이라는 단어를 무심코 지나쳐 실제 값 손실 방향을 오판할 위험이 있다.",
      "evidence": "L06: \"DATA(lv_seats) = CONV i( '3.7' ).   \\\" 4 — 0.3의 손실(반올림)을 감수하고 변환\" — 대조 문구 없음. 반면 L10: \"⚠️ 정수 나눗셈 주의 — ABAP의 정수(i) 계산은 나눗셈에서 소수점을 버리지 않고 반올림한다... '소수점은 버린다'가 기본인 다른 언어와 달라 조용한 계산 차이를 만드는 지점이다.\" — 같은 성격의 반올림 경고를 L10에서는 명시적으로 언어 간 대조까지 해 준다.",
      "suggestion": "L06의 CONV 반올림 문장 옆에도 L10과 같은 형태로 \"Java/C#의 (int) 캐스팅·narrowing 변환은 버림(truncate)이지만 ABAP CONV는 반올림한다\"는 1줄 대조를 추가한다."
    },
    {
      "seq": 2,
      "file": "content/abap/CH18/CH18-L04.md",
      "quote": "**예외**가 난다. 예외(Exception)란 프로그램이 \"이 상황은 정상 진행이 불가능하다\"고 알리는",
      "category": "과잉",
      "severity": "낮음",
      "confidence": "확실",
      "claim": "'예외(Exception)가 무엇인가'를 정의하는 문단은 Java/C# 3~5년차 개발자에게는 이미 완전히 체화된 개념이라 불필요한 장황함으로 읽힌다. 다만 이 사이트의 1독자는 완전 입문자이므로 정의 자체를 지우기보다, 경력자가 건너뛸 수 있다는 표시나 압축 대안이 있으면 좋겠다.",
      "evidence": "\"Table expression은 일반 값 표현식이라, 없는 행을 직접 읽으면 CX_SY_ITAB_LINE_NOT_FOUND 예외가 난다. 예외(Exception)란 프로그램이 '이 상황은 정상 진행이 불가능하다'고 알리는 신호로, 잡아서 처리하지 않으면 프로그램이 그 자리에서 중단된다(짧은 덤프 화면).\" — 예외의 일반 정의까지 풀어 설명한다.",
      "suggestion": "예외의 일반 정의 문장은 그대로 두되, 경력자를 위해 괄호로 \"(Java/C#의 checked/unchecked exception과 같은 개념)\" 정도의 1구절만 덧붙이면 별도 설명 없이 바로 다음 요지로 넘어갈 수 있다."
    },
    {
      "seq": 3,
      "file": "content/abap/CH18/CH18-L10.md",
      "quote": "🎯 **리팩터링**(Refactoring, 동작은 그대로 두고 코드의 짜임새를 개선하는 활동 전반 — 이 레슨에선 그중 \"표현을 모던 문법으로 다듬기\"만 다룬다)의 목표는 **줄 수를 줄이는 게 아니다.**",
      "category": "과잉",
      "severity": "낮음",
      "confidence": "확실",
      "claim": "'리팩터링'은 업계 표준 용어로 경력 3~5년차 개발자에게는 사전 정의가 전혀 필요 없다. 이 챕터에서 정의 자체는 입문자에게 필요하지만, 경력자 입장에서는 이 레슨의 핵심(★ '짧게'가 아니라 '판단 기준 3가지')에 도달하기까지 읽어야 할 서두가 길게 느껴진다.",
      "evidence": "\"🎯 리팩터링(Refactoring, 동작은 그대로 두고 코드의 짜임새를 개선하는 활동 전반 — 이 레슨에선 그중 '표현을 모던 문법으로 다듬기'만 다룬다)의 목표는 줄 수를 줄이는 게 아니다.\" — 일반 개발 상식 용어를 처음부터 정의하고 들어간다.",
      "suggestion": "정의는 유지하되 바로 뒤에 \"① 의도가 더 잘 보이고 ② 실수할 구석이 줄고 ③ 실행 결과는 똑같이\"라는 3원칙을 굵게 먼저 보여주고 정의는 부연으로 뒤에 배치하면, 경력자는 3원칙만 훑고 바로 코드 비교로 넘어갈 수 있다."
    },
    {
      "seq": 4,
      "file": "content/abap/CH18/CH18-L08.md",
      "quote": "[[REDUCE]]는 **초기값**을 만들고, 반복하며 누적 변수에 값을 더해 **최종 결과 하나**를 만든다.",
      "category": "지름길 부재",
      "severity": "낮음",
      "confidence": "확실",
      "claim": "REDUCE·FILTER는 Java Stream의 reduce()/filter()나 C# LINQ의 Aggregate()/Where()와 개념적으로 거의 동일하다. 경력자가 바로 대응시킬 수 있는 짧은 비유 문구가 레슨 어디에도 없어, 익숙한 패턴인데도 처음 보는 개념처럼 처음부터 다시 읽게 된다.",
      "evidence": "L08 전체(REDUCE·FILTER 도입부·INIT/NEXT 설명·흔한 실수 항목)에 Java Stream/LINQ 등 유사 개념에 대한 언급이 전혀 없다. ABAP 고유 문법(키워드 순서, FOR IN, sorted/hashed key 제약)만 설명한다.",
      "suggestion": "REDUCE 도입부나 FILTER 도입부에 괄호로 \"(자바 Stream.reduce()·C# LINQ Aggregate()와 같은 개념)\", \"(자바 Stream.filter()·LINQ Where()와 같은 개념)\" 같은 1줄 비유를 덧붙이면 경력자가 문법만 빠르게 익힐 수 있다."
    },
    {
      "seq": 5,
      "file": "content/abap/CH18/CH18-L10.md",
      "quote": "[산술 연산과 대입](CH04-L01.html)에서 배운 `lv_total = lv_total + x`를, **같은 변수를 한 번만 쓰고** 끝내는 짧은 표기가 있다. 이것을 **복합 대입**(compound assignment, 계산하면서 동시에 대입)이라고 한다.",
      "category": "과잉",
      "severity": "낮음",
      "confidence": "확실",
      "claim": "`+=`·`-=`·`*=`·`/=`는 Java/C#에서 매일 쓰는 연산자와 문법·의미가 완전히 같아, '복합 대입이 무엇인가'를 새로 설명할 필요가 없다. 경력자에게 실제로 필요한 정보는 이 레슨 바로 아래에 나오는 두 가지 제약(왼쪽 변수가 미리 선언돼 있어야 함, 정수 나눗셈은 반올림)뿐이다.",
      "evidence": "\"[산술 연산과 대입](CH04-L01.html)에서 배운 lv_total = lv_total + x를, 같은 변수를 한 번만 쓰고 끝내는 짧은 표기가 있다. 이것을 복합 대입(compound assignment, 계산하면서 동시에 대입)이라고 한다.\" — 연산자 자체의 의미를 처음부터 설명한다.",
      "suggestion": "정의 문장은 입문자를 위해 유지하되, 바로 뒤에 \"Java/C#의 +=/-=/*=//=와 문법·동작이 동일하다\" 한 줄을 추가하면 경력자는 그 줄만 보고 아래 두 함정(선언 필요·나눗셈 반올림)으로 바로 건너뛸 수 있다."
    }
  ],
  "overall": {
    "grade_opinion": "경미 수정",
    "summary": "CH18은 modern ABAP 문법 하나하나를 classic 대비·주의사항까지 꼼꼼히 짚어 경력 개발자가 읽어도 오정보는 거의 없다. 특히 1-based 인덱스(L04), 인라인 변수의 블록 스코프(L01), 정수 나눗셈 반올림(L10) 같은 '타 언어와 다른 지점'은 이미 명시적으로 대조해 주는 좋은 선례가 있다. 다만 CONV의 소수→정수 반올림(L06)에는 같은 수준의 언어 간 대조가 빠져 있어 형평이 안 맞고, 경력자에게는 이미 아는 일반 개발 용어(예외, 리팩터링, 복합 대입)의 정의 문단과 Java Stream/LINQ에 대응하는 REDUCE·FILTER 비유 부재가 사소한 장황함으로 느껴진다. 다섯 건 모두 삭제가 아니라 1줄 보강·대조 추가로 해결 가능한 경미한 수준이라 재집필은 불필요하다."
  }
}
