{"agent":"AG06","model":"gpt-5.6-sol","target":"CH06","persona_ack":"20년차 SAP ABAP 아키텍트 관점에서 CH06의 문법, 내부 테이블 동작, 예시 적절성 및 위험한 생략을 읽기 전용으로 감사했다.","method":"PowerShell Get-Content를 UTF-8로 지정해 대상 Markdown 7개를 원문 전체 읽기하고, 외부 검색 없이 ABAP 문법 및 런타임 동작 지식과 대조했다.","errors":[],"files_read":["C:\\SAP\\sap-dev-academy\\content\\abap\\CH06\\CH06-L01.md","C:\\SAP\\sap-dev-academy\\content\\abap\\CH06\\CH06-L02.md","C:\\SAP\\sap-dev-academy\\content\\abap\\CH06\\CH06-L03.md","C:\\SAP\\sap-dev-academy\\content\\abap\\CH06\\CH06-L04.md","C:\\SAP\\sap-dev-academy\\content\\abap\\CH06\\CH06-L05.md","C:\\SAP\\sap-dev-academy\\content\\abap\\CH06\\CH06-L06.md","C:\\SAP\\sap-dev-academy\\content\\abap\\CH06\\_chapter.md"],"findings":[{"seq":1,"file":"C:\\SAP\\sap-dev-academy\\content\\abap\\CH06\\CH06-L01.md","quote":"`it_`는 Header Line을 가진 옛 방식 테이블에만 쓴다.","category":"예시 적절성","severity":"낮음","confidence":"확실","claim":"`it_` 접두어는 Header Line 전용 관례가 아니다.","evidence":"많은 ABAP 명명 규칙에서 `it_`는 입력용 내부 테이블이나 일반 내부 테이블을 뜻하며, Header Line 유무와 문법적 관계가 없다. 이 설명은 후속 코드의 접두어를 잘못 판독하게 만든다.","suggestion":"“접두어 규칙은 프로젝트마다 다르며, 이 교재에서는 전역 내부 테이블에 `gt_`를 사용한다”로 한정하고 `it_`와 Header Line을 연결하지 않는다."},{"seq":2,"file":"C:\\SAP\\sap-dev-academy\\content\\abap\\CH06\\CH06-L02.md","quote":"`WITH NON-UNIQUE KEY name`으로 직접 정할 수도 있다(`UNIQUE`면 중복 금지).","category":"사실 오류","severity":"중간","confidence":"확실","claim":"예시에 나온 STANDARD TABLE의 기본 키를 단순히 `UNIQUE`로 바꿀 수 있는 것처럼 설명했다.","evidence":"STANDARD TABLE의 기본 키는 항상 NON-UNIQUE이다. UNIQUE 기본 키는 SORTED TABLE 또는 HASHED TABLE에서 선언한다.","suggestion":"STANDARD 예시는 `WITH NON-UNIQUE KEY name`으로 유지하고, 별도로 `TYPES ... TYPE SORTED TABLE OF ... WITH UNIQUE KEY name.` 또는 HASHED TABLE 예시를 제시한다."},{"seq":3,"file":"C:\\SAP\\sap-dev-academy\\content\\abap\\CH06\\CH06-L03.md","quote":"`INSERT gs_... INTO TABLE gt_....` — **키에 맞는 자리**에 넣기.","category":"사실 오류","severity":"높음","confidence":"확실","claim":"`INSERT ... INTO TABLE`이 모든 내부 테이블에서 키 순서에 맞는 위치를 선택한다고 일반화했다.","evidence":"STANDARD TABLE에는 키에 따른 정렬 위치가 없으며 이 구문은 행을 끝에 추가한다. 키가 저장 위치를 결정하는 설명은 SORTED TABLE과 HASHED TABLE에만 맞는다.","suggestion":"“테이블 종류에 맞게 삽입: STANDARD는 끝에 추가, SORTED는 정렬 위치에 삽입, HASHED는 해시 관리 영역에 삽입”으로 구분한다."},{"seq":4,"file":"C:\\SAP\\sap-dev-academy\\content\\abap\\CH06\\CH06-L03.md","quote":"찾기에 성공하면 시스템 필드 [[sy-tabix]]에 **그 행의 번호**가 들어온다.","category":"사실 오류","severity":"중간","confidence":"확실","claim":"READ TABLE 성공 시 `sy-tabix`가 항상 행 번호를 제공한다고 설명했다.","evidence":"HASHED TABLE에는 테이블 인덱스와 행 번호가 없으므로 키 읽기에 성공해도 `sy-tabix`는 0이다. 같은 장에서 세 종류를 함께 가르치므로 STANDARD/SORTED에만 적용된다는 제한이 필요하다.","suggestion":"“STANDARD/SORTED TABLE에서는 행 인덱스가 들어오며, HASHED TABLE에서는 0이다”라고 명시한다."},{"seq":5,"file":"C:\\SAP\\sap-dev-academy\\content\\abap\\CH06\\CH06-L03.md","quote":"(`SORT`의 대상은 STANDARD·HASHED).","category":"사실 오류","severity":"높음","confidence":"확실","claim":"HASHED TABLE을 `SORT` 문장의 대상으로 안내했다.","evidence":"HASHED TABLE은 테이블 인덱스와 정의된 행 순서가 없어 `SORT`할 수 없다. 정적 HASHED TABLE을 대상으로 사용하면 올바른 ABAP 문장이 되지 않는다.","suggestion":"“`SORT`로 임의 재정렬할 수 있는 대상은 STANDARD TABLE이며, SORTED/HASHED TABLE에는 사용할 수 없다”로 수정한다."},{"seq":6,"file":"C:\\SAP\\sap-dev-academy\\content\\abap\\CH06\\CH06-L04.md","quote":"가리키는 행을 직접 수정하니\n> `MODIFY`가 필요 없다.","category":"위험한 생략","severity":"중간","confidence":"확실","claim":"`LOOP ... ASSIGNING`의 직접 수정에서 테이블 키 변경 제한을 안내하지 않았다.","evidence":"SORTED/HASHED TABLE의 키 필드를 Field Symbol로 직접 변경하면 내부 정렬 또는 해시 관리가 깨지므로 허용되지 않으며 런타임 오류로 이어질 수 있다. 앞 레슨에서 이 테이블 종류들을 이미 소개했다.","suggestion":"예제처럼 비키 필드만 수정하도록 명시하고, SORTED/HASHED TABLE의 키를 바꾸려면 기존 행을 삭제한 뒤 새 키로 다시 삽입하라고 경고한다."}],"overall":{"grade_opinion":"보강 권장","summary":"Internal Table의 기본 개념과 STANDARD TABLE 중심 실습은 대체로 적절하다. 다만 STANDARD TABLE의 UNIQUE 키, `INSERT ... INTO TABLE`, HASHED TABLE의 `SORT` 및 `sy-tabix`에 관한 명백한 오류가 있어 테이블 종류별 동작을 다시 구분해야 한다. Field Symbol로 키 필드를 직접 변경할 때의 런타임 위험도 초급 단계에서 함께 경고할 필요가 있다."}}