{"agent":"AG02","model":"gpt-5.6-sol","target":"CH07","persona_ack":"실습형 학습자 ‘준호’의 관점에서 각 레슨의 본문 코드·설명과 체험 위젯을 대조 감사했다.","method":"대상 Markdown·HTML 8개와 명시적으로 허용된 공통 엔진 JavaScript 5개를 소스 정독했다. 하네스의 localhost:8141에서 Playwright 1.62.1/Chromium을 한 번 기동해 위젯 4개를 각각 새 탭에서 HTTP 200 응답, 콘솔·페이지 오류, 렌더 DOM 및 가로 오버플로를 확인했다. L01은 정상 활성화와 불연속 키 활성화 실패, L02는 정상 저장·중복 거부·오답 저장·클라이언트 전환, L03-S01은 타입 출처·담는 개수 전환, L03-S02는 행 선택과 상세 표시를 실제 조작했다.","errors":[],"files_read":["C:\\SAP\\sap-dev-academy\\content\\abap\\CH07\\CH07-L01.md","C:\\SAP\\sap-dev-academy\\content\\abap\\CH07\\CH07-L02.md","C:\\SAP\\sap-dev-academy\\content\\abap\\CH07\\CH07-L03.md","C:\\SAP\\sap-dev-academy\\content\\abap\\CH07\\_chapter.md","C:\\SAP\\sap-dev-academy\\embeds\\abap\\CH07-L01-S01.html","C:\\SAP\\sap-dev-academy\\embeds\\abap\\CH07-L02-S01.html","C:\\SAP\\sap-dev-academy\\embeds\\abap\\CH07-L03-S01.html","C:\\SAP\\sap-dev-academy\\embeds\\abap\\CH07-L03-S02.html","C:\\SAP\\sap-dev-academy\\embeds\\_engine\\se11-table-builder.js","C:\\SAP\\sap-dev-academy\\embeds\\_engine\\se11-create-entries.js","C:\\SAP\\sap-dev-academy\\embeds\\_engine\\type-borrow-lab.js","C:\\SAP\\sap-dev-academy\\embeds\\_engine\\compare-matrix.js","C:\\SAP\\sap-dev-academy\\embeds\\_engine\\_autoheight.js"],"findings":[{"seq":1,"file":"C:\\SAP\\sap-dev-academy\\embeds\\abap\\CH07-L01-S01.html","quote":"키를 켜고 끄고, 타입을 <b>Data Element ↔ Built-In</b>으로 바꿔 가며 <b>검사 → 활성화</b>를 눌러 보세요.","category":"불일치·위젯 결함","severity":"높음","confidence":"확실","claim":"위젯은 본문이 활성화 필수 조건으로 가르치는 Technical Settings를 전혀 입력·판정하지 않으면서 DB 물리 테이블 활성화 성공을 허용한다.","evidence":"본문은 Data Class와 Size Category를 지정하지 않으면 활성화가 거부된다고 명시한다. 그러나 위젯 cfg에는 table과 fields만 있고 두 설정이 없으며, 엔진 validate()도 키 연속성과 타입만 검사한다. 브라우저에서 초기 상태 그대로 활성화를 누르자 실제로 “활성화 완료 — DB에 물리 테이블이 생성됐습니다.”가 표시됐다.","suggestion":"활성화 전에 Data Class와 Size Category를 선택하게 하고 미선택 시 실패하도록 판정을 추가한다. Delivery Class와 Data Browser/Table View Maint.도 최소한 확인 단계에 포함해 본문의 SE11 절차와 맞춘다."},{"seq":2,"file":"C:\\SAP\\sap-dev-academy\\embeds\\abap\\CH07-L01-S01.html","quote":"{ \"name\": \"MANDT\",  \"fixed\": true, \"key\": true, \"type\": \"CLNT\", \"note\": \"클라이언트(자동)\" }","category":"불일치","severity":"중간","confidence":"확실","claim":"테이블 빌더가 MANDT 필드 자체를 자동으로 생기는 항목처럼 안내해, 본문의 명시적 구분과 어긋난다.","evidence":"본문은 “필드 MANDT 자체는 내가 직접 첫 키로 넣는다”고 명시하고, 자동인 것은 현재 로그온 클라이언트에 대한 읽기·쓰기 필터링이라고 구분한다. 반면 위젯은 필드를 고정해 두고 “클라이언트(자동)”이라고만 표시한다.","suggestion":"표시를 “클라이언트 분리용(직접 첫 키로 추가)”으로 바꾸고, 자동인 것은 현재 클라이언트 처리라는 별도 안내를 붙인다."},{"seq":3,"file":"C:\\SAP\\sap-dev-academy\\embeds\\abap\\CH07-L03-S02.html","quote":"{ \"name\": \"Structure (Work Area)\", \"cells\": [{\"v\":\"한 건\",\"r\":\"mid\"},{\"v\":\"메모리\",\"r\":\"mid\"},{\"v\":\"실행 중\",\"r\":\"lo\"},{\"v\":\"TYPE ts_line\"}],","category":"불일치","severity":"낮음","confidence":"확실","claim":"비교 위젯이 타입인 Structure와 그 타입으로 선언한 메모리 변수의 역할인 Work Area를 하나의 항목으로 합쳐 표시한다.","evidence":"본문 표는 Structure를 “한 줄 모양 타입”으로 설명하고, 타입 자체는 정의일 뿐이며 그 타입으로 선언한 변수가 메모리에 존재하고 Work Area는 그 변수의 역할이라고 구분한다. 위젯 행은 Structure 자체가 한 건을 담아 메모리에서 실행 중 사는 것처럼 읽힌다.","suggestion":"행 이름을 “Structure 타입으로 선언한 변수(Work Area 역할)”로 고치거나, Structure 타입과 실제 변수/Work Area 역할을 별도로 구분한다."}],"overall":{"grade_opinion":"보강 권장","summary":"모든 레슨 페이지에는 코드에 대응하는 위젯이 있어 체험 공백은 없었고, L02와 L03 위젯의 주요 조작·판정은 정상 동작했다. 다만 L01 핵심 체험이 Technical Settings 없이도 활성화를 성공시켜 실제 SE11 절차와 정면으로 어긋난다. MANDT의 자동성 및 Structure와 Work Area의 구분도 안내를 다듬을 필요가 있다."}}