{"agent":"AG09","model":"gpt-5.6-sol","target":"CH12","persona_ack":"ABAP 코드 블록만 줄 단위로 검사하는 AG09 코드 전용 감사자로서 지정된 CH12 파일만 감사했다.","method":"PowerShell Get-Content로 지정된 8개 Markdown 파일만 읽고, ```abap 코드 블록을 추출해 활성화 차단 요소·네이밍·챕터 경계 문법·코드 내 문자열 오류를 정적으로 대조했다.","errors":[],"files_read":["C:\\SAP\\sap-dev-academy\\content\\abap\\CH12\\CH12-L01.md","C:\\SAP\\sap-dev-academy\\content\\abap\\CH12\\CH12-L02.md","C:\\SAP\\sap-dev-academy\\content\\abap\\CH12\\CH12-L03.md","C:\\SAP\\sap-dev-academy\\content\\abap\\CH12\\CH12-L04.md","C:\\SAP\\sap-dev-academy\\content\\abap\\CH12\\CH12-L05.md","C:\\SAP\\sap-dev-academy\\content\\abap\\CH12\\CH12-L06.md","C:\\SAP\\sap-dev-academy\\content\\abap\\CH12\\CH12-L07.md","C:\\SAP\\sap-dev-academy\\content\\abap\\CH12\\_chapter.md"],"findings":[{"seq":1,"file":"C:\\SAP\\sap-dev-academy\\content\\abap\\CH12\\CH12-L06.md","quote":"DATA: gr_stat TYPE RANGE OF zbooking-status,","category":"네이밍 규약","severity":"낮음","confidence":"확실","claim":"전역 범위 테이블에 허용된 테이블 접두사 gt_가 아니라 gr_를 사용했다.","evidence":"이 코드는 FORM이나 METHOD 내부가 아닌 전역 코드이며, TYPE RANGE OF로 선언한 gr_stat은 내부 테이블이다. 제시된 커리큘럼 규칙상 전역 내부 테이블은 gt_ 접두사를 사용해야 한다.","suggestion":"gr_stat을 gt_stat으로 바꾸고 같은 코드 블록의 LIKE LINE OF, APPEND, WHERE IN 참조도 모두 gt_stat으로 통일한다."}],"overall":{"grade_opinion":"경미 수정","summary":"검사한 ABAP 코드 블록에서 활성화를 막을 명백한 문법·선언·타입·시그니처 오류나 금지된 modern/New Open SQL 문법은 확인되지 않았다. CH12-L06의 전역 Range Table 접두사 gr_만 커리큘럼 네이밍 규약과 어긋난다."}}