{"agent":"AG03","model":"gpt-5.6-sol","target":"CH23","persona_ack":"Java/C# 계열 백엔드 3~5년차 개발자의 관점으로 CH23을 읽기 전용 감사했다.","method":"PowerShell Get-Content -Raw -Encoding UTF8로 지정된 8개 Markdown 파일만 읽고, 파일 간 내부 일관성과 ABAP 지식을 기준으로 통독 검토했다. 웹·외부 네트워크·지정 외 파일은 사용하지 않았다.","errors":[],"files_read":["C:\\SAP\\sap-dev-academy\\content\\abap\\CH23\\CH23-L01.md","C:\\SAP\\sap-dev-academy\\content\\abap\\CH23\\CH23-L02.md","C:\\SAP\\sap-dev-academy\\content\\abap\\CH23\\CH23-L03.md","C:\\SAP\\sap-dev-academy\\content\\abap\\CH23\\CH23-L04.md","C:\\SAP\\sap-dev-academy\\content\\abap\\CH23\\CH23-L05.md","C:\\SAP\\sap-dev-academy\\content\\abap\\CH23\\CH23-L06.md","C:\\SAP\\sap-dev-academy\\content\\abap\\CH23\\CH23-L07.md","C:\\SAP\\sap-dev-academy\\content\\abap\\CH23\\_chapter.md"],"findings":[{"seq":1,"file":"C:\\SAP\\sap-dev-academy\\content\\abap\\CH23\\CH23-L01.md","quote":"`{ }` 안의 select list는 [INTO TABLE @DATA(...) Inline Target](CH19-L03.html)에서 익힌 SELECT 감각과\n닮았지만, **지금 데이터를 가져오는 문장이 아니다.**","category":"과잉·지름길 부재","severity":"낮음","confidence":"확실","claim":"SQL 뷰나 ORM 읽기 모델을 경험한 개발자에게는 선언과 즉시 실행의 차이, 필드별 문법표, 원본 컬럼이 생기지 않는다는 설명이 연속되어 다소 길지만 이를 건너뛸 안내가 없다.","evidence":"입문자에게는 필요한 설명이지만, 경력자는 일반적인 선언형 뷰 개념보다 `define view entity`, CDS의 `key`, 활성화 방식처럼 ABAP 고유 차이만 빠르게 확인하면 된다.","suggestion":"첫 코드 앞에 경력자용 지름길을 추가해 ‘왜 필요한가’와 코드 낱줄 해설은 건너뛰고, ABAP 고유 차이와 흔한 실수부터 읽을 수 있게 한다. 본문 자체는 입문자를 위해 유지한다."},{"seq":2,"file":"C:\\SAP\\sap-dev-academy\\content\\abap\\CH23\\CH23-L02.md","quote":"**기반 뷰의 annotation은 자동으로 물려받는다.**","category":"오개념 유발","severity":"중간","confidence":"확실","claim":"모든 annotation이 일반적인 상속처럼 자동 전달된다는 표현은 지나치게 넓다.","evidence":"CDS의 annotation 전파는 annotation 종류와 요소 투영 방식 등에 따라 달라지며, 전파 가능한 요소 annotation도 `@Metadata.ignorePropagatedAnnotations`로 억제할 수 있다. entity 수준 annotation이나 접근 제어까지 포괄적으로 상속된다고 이해하면 L06의 DCL 설명과도 충돌한다.","suggestion":"‘전파 가능한 일부 요소 annotation은 단순 투영 시 기본적으로 전달될 수 있다’로 한정하고, 전파 여부는 metadata에서 확인하며 모든 annotation과 DCL이 상속되는 것은 아니라고 명시한다."},{"seq":3,"file":"C:\\SAP\\sap-dev-academy\\content\\abap\\CH23\\CH23-L03.md","quote":"cardinality를 `[1..1]`로 바꿨는데 회차가 여러 개면\n어떤 경고가 뜨는지","category":"용어 충돌·오개념 유발","severity":"중간","confidence":"확실","claim":"교육용 시뮬레이터의 경고와 실제 CDS/DB의 cardinality 동작을 구분하지 않아, cardinality가 데이터 무결성 제약처럼 검증된다고 오해할 수 있다.","evidence":"CDS association cardinality는 실제 행 수를 강제하는 DB 제약이 아니며, 운영 데이터가 선언을 위반해도 그 사실을 자동 검사해 항상 경고하는 것이 아니다. 반대로 옵티마이저가 선언을 활용할 수 있어 잘못 지정하면 결과나 최적화에 영향을 줄 수 있다.","suggestion":"해당 경고가 시뮬레이터의 교육용 검증임을 표시하고, 실제 시스템에서는 별도의 키·제약·데이터 테스트로 검증해야 한다는 문장과 잘못된 cardinality의 최적화 위험을 추가한다."},{"seq":4,"file":"C:\\SAP\\sap-dev-academy\\content\\abap\\CH23\\CH23-L04.md","quote":"[L01](CH23-L01.html)의 항공편 모델 `ZI_Flight`에는 `price`와 `currency`가 실제로 있으니, 이 둘로 금액-통화 짝을 선언한다.","category":"내부 불일치·오개념 유발","severity":"중간","confidence":"확실","claim":"L01에 정의된 `ZI_Flight`에는 `price`와 `currency` 요소가 없으므로 이 설명과 뒤의 annotation 예제를 그대로 적용할 수 없다.","evidence":"L01의 select list는 `carrid`, `connid`, `fldate`, `seatsmax`, `seatsocc`, `seats_left`만 노출한다. 원본 `sflight` 테이블에 컬럼이 있더라도 CDS entity가 노출하지 않으면 해당 entity의 요소 annotation 대상으로 쓸 수 없다.","suggestion":"L01의 `ZI_Flight`에 `price`와 `currency`를 추가하거나, L04에서 두 요소를 포함한 완전한 CDS 예제를 다시 제시한다."},{"seq":5,"file":"C:\\SAP\\sap-dev-academy\\content\\abap\\CH23\\CH23-L06.md","quote":"where ( venue ) = aspect pfcg_auth( Z_VENUE_AUTH, VENUE, ACTVT = '03' );","category":"실행 불가 예제","severity":"중간","confidence":"확실","claim":"예시 권한 객체명 `Z_VENUE_AUTH`는 12자로, PFCG 권한 객체 기술명 길이 제한을 초과한다.","evidence":"SAP 권한 객체 기술명은 최대 10자이므로 이 이름의 권한 객체를 만들 수 없고, 존재하는 객체를 참조해야 하는 `pfcg_auth` 예제로 사용할 수 없다.","suggestion":"10자 이하의 이름(예: `Z_VENUE`)으로 교체하고, 그 객체에 `VENUE`와 `ACTVT` 필드가 실제로 정의되어 있어야 한다고 덧붙인다."},{"seq":6,"file":"C:\\SAP\\sap-dev-academy\\content\\abap\\CH23\\CH23-L06.md","quote":"**같은 SELECT**인데\n사용자 권한에 따라 보이는 행이 달라지고, `#NOT_REQUIRED`면 권한 밖 venue까지 노출되는 것을 직접 확인할 수 있다.","category":"오개념 유발·보안","severity":"높음","confidence":"확실","claim":"DCL이 존재할 때 `#NOT_REQUIRED`로 바꾸면 권한 필터가 꺼진다는 설명은 틀리다.","evidence":"`#NOT_REQUIRED`는 access control이 없어도 된다는 의미이며, 연결된 DCL이 존재하면 해당 access control은 여전히 적용된다. `#CHECK`와의 핵심 차이는 DCL 부재를 허용하고 관련 경고를 요구하지 않는다는 점이지, 기존 DCL을 우회하는 것이 아니다.","suggestion":"토글 결과 설명을 삭제하고 `#CHECK`와 `#NOT_REQUIRED` 모두 DCL이 있으면 적용된다고 바로잡는다. 필터가 없는 결과를 비교하려면 DCL이 없는 별도 entity 등 의미가 명확한 예제를 사용하고, `#NOT_ALLOWED` 및 privileged access는 별도 주제로 정확히 구분한다."}],"overall":{"grade_opinion":"보강 권장","summary":"계층·Association·Metadata Extension·DCL을 한 흐름으로 묶은 구성은 경력자가 빠르게 구조를 파악하기에도 좋다. 다만 `#NOT_REQUIRED`의 의미를 잘못 설명한 보안상 중요한 오류, 실행할 수 없는 권한 객체명, annotation 전파의 과도한 일반화, cardinality를 제약처럼 오해할 여지, 레슨 간 예제 불일치가 있어 수정이 필요하다. 경력자용 빠른 읽기 경로는 L01에 짧게 추가하는 정도면 충분하다."}}