{
  "agent": "AG03",
  "model": "opus",
  "target": "CH01",
  "persona_ack": "타 언어(Java/C# 계열) 백엔드 3～5년차 개발자의 시선으로 CH01 7개 레슨과 챕터 파일을 통독했다. 변수·조건문·루프·SQL·OOP는 이미 아는 상태를 가정하고 ① 과잉 ② 오개념 유발 ③ 지름길 부재 ④ 용어 충돌 네 축으로 기록했다. 이 사이트의 1독자가 비전공 입문자임을 감안해, '입문자에겐 필요하지만 경력자에겐 이미 아는 내용'은 높음으로 올리지 않고 낮음 또는 suggestion으로 내렸다.",
  "method": "Read 도구로 대상 8개 파일 전문을 통독(읽기 전용, 수정·생성·실행 없음). 웹 검색·외부 네트워크·타 감사 산출물 미사용, 보유 ABAP 지식만으로 판단. 모든 quote는 대상 파일 원문에서 그대로 복사했고, 이스케이프 오류를 피하려 큰따옴표가 없는 구간을 앵커로 골랐다.",
  "errors": [],
  "files_read": [
    "C:\\SAP\\sap-dev-academy\\content\\abap\\CH01\\_chapter.md",
    "C:\\SAP\\sap-dev-academy\\content\\abap\\CH01\\CH01-L01.md",
    "C:\\SAP\\sap-dev-academy\\content\\abap\\CH01\\CH01-L02.md",
    "C:\\SAP\\sap-dev-academy\\content\\abap\\CH01\\CH01-L03.md",
    "C:\\SAP\\sap-dev-academy\\content\\abap\\CH01\\CH01-L04.md",
    "C:\\SAP\\sap-dev-academy\\content\\abap\\CH01\\CH01-L05.md",
    "C:\\SAP\\sap-dev-academy\\content\\abap\\CH01\\CH01-L06.md",
    "C:\\SAP\\sap-dev-academy\\content\\abap\\CH01\\CH01-L07.md"
  ],
  "findings": [
    {
      "seq": 1,
      "file": "C:\\SAP\\sap-dev-academy\\content\\abap\\CH01\\CH01-L04.md",
      "quote": "작은따옴표로 감싼 `'...'`가 **문자(텍스트) [[리터럴]]** 이다.",
      "category": "용어 충돌",
      "severity": "중간",
      "confidence": "확실",
      "claim": "리터럴을 작은따옴표로 도입하면서, 타 언어 습관대로 큰따옴표를 쓰면 문자열이 아니라 주석이 된다는 경고가 없다. 경력자가 가장 먼저 밟는 지뢰인데 이 절에도, 바로 아래 '흔한 실수'에도 없다.",
      "evidence": "CH01-L03에서 `\"`가 인라인 주석이라고 배우긴 하지만, 리터럴을 정식 도입하는 이 절과 이어지는 '흔한 실수와 점검'(따옴표 짝 안 맞음·`/` 누락·마침표 누락) 어디에도 그 충돌이 없다. Java·C#·JS·Python 경력자는 반사적으로 `WRITE \"Hello\".`를 친다. ABAP에서는 `\"` 뒤 줄 끝까지가 전부 주석이라 문장을 끝내는 마침표까지 주석에 먹히고, 그 결과 다음 문장과 붙어 원인을 짐작하기 어려운 구문 오류가 난다 — CH01-L03이 '앞 문장의 마침표 누락으로 두 문장이 붙었다'로 설명한 바로 그 증상인데, 두 설명이 연결돼 있지 않다.",
      "suggestion": "리터럴 절 또는 흔한 실수에 한 줄 추가 — 'ABAP 문자열은 작은따옴표만이다. 큰따옴표는 주석이라 다른 언어처럼 쓰면 출력이 사라지는 정도가 아니라, 마침표까지 주석에 먹혀 엉뚱한 구문 오류가 난다.' 이미 있는 시뮬레이터에 예제 칩으로 한 번 재현시키면 입문자에게도 부담 없이 각인된다."
    },
    {
      "seq": 2,
      "file": "C:\\SAP\\sap-dev-academy\\content\\abap\\CH01\\CH01-L01.md",
      "quote": "[[SAPGUI]]는 서버에 연결하는 데스크톱 클라이언트다.",
      "category": "용어 충돌",
      "severity": "중간",
      "confidence": "확실",
      "claim": "같은 레슨 안에서 '클라이언트'가 두 가지 완전히 다른 뜻으로 쓰이는데, 그 충돌 자체를 짚어 주지 않는다.",
      "evidence": "이 문장에서 SAPGUI를 client-server 의미의 '데스크톱 클라이언트'라고 부른 직후, 로그온 입력값 절에서 'Client — 같은 시스템 안의 독립된 작업 공간(3자리 숫자, 예: 100)'이라며 같은 단어를 테넌트 의미로 재사용한다. 뒤따르는 'Client가 뭐죠?' 콜아웃은 Client가 무엇인지만 설명할 뿐, 13줄 위에서 쓴 '클라이언트'와 이름만 같고 별개라는 안내가 없다. 클라이언트=접속 프로그램이 몸에 밴 경력자는 이 칸을 '접속 클라이언트 설정'으로 오독하기 쉽다.",
      "suggestion": "Client 콜아웃 첫 줄에 충돌 해제 문장 한 줄 — '방금 말한 클라이언트(SAPGUI라는 접속 프로그램)와 이 Client는 이름만 같고 전혀 다르다. SAP의 Client는 데이터가 서로 분리된 테넌트다.' 원어 Mandant를 괄호로 병기하면 영문 문서·검색 대조에도 도움이 된다."
    },
    {
      "seq": 3,
      "file": "C:\\SAP\\sap-dev-academy\\content\\abap\\CH01\\CH01-L03.md",
      "quote": "코드를 **저장**하면 일단 **inactive(비활성)** 버전이 된다.",
      "category": "오개념 유발",
      "severity": "중간",
      "confidence": "확실",
      "claim": "저장/활성화를 '초안 → 승격'이라는 개인 작업 비유로만 설명해서, 활성화가 그 서버를 쓰는 모든 사람의 실행본을 즉시 바꾼다는 핵심이 빠졌다.",
      "evidence": "'저장 = 초안 보관(inactive)', '활성화 = 이 초안을 진짜 실행본으로 승격'이라는 설명은 로컬 빌드·git 커밋에 익숙한 경력자에게 '내 작업 공간 안에서 일어나는 일'로 읽힌다. 실제 ABAP은 소스도 활성 버전도 공유 애플리케이션 서버에 있어, 활성화하는 순간 같은 시스템의 다른 사용자와 다른 프로그램이 그 버전을 실행한다(내 PC에는 아무것도 빌드되지 않는다). CH01-L02가 '같은 서버의 동료는 조회·실행할 수 있다'고 적어 두고도 그 사실을 활성화 설명과 연결하지 않아, 두 조각이 따로 논다. 활성화 덮어쓰기 경고가 왜 그렇게 무거운지도 이 연결이 있어야 납득된다.",
      "suggestion": "이미 있는 덮어쓰기 경고 콜아웃에 한 줄만 덧붙이면 된다 — '활성화된 순간부터 같은 시스템을 쓰는 모든 사람이 그 버전을 실행한다. 내 PC에서의 빌드가 아니라 서버 반영이다.' 입문자에게도 CH01-L01의 서버 이야기와 자연스럽게 이어진다."
    },
    {
      "seq": 4,
      "file": "C:\\SAP\\sap-dev-academy\\content\\abap\\CH01\\CH01-L02.md",
      "quote": "입문 단계엔 `SE38` 하나로 충분하고, 다룰 오브젝트가 늘면 그때 편해진다.",
      "category": "과잉",
      "severity": "중간",
      "confidence": "확실",
      "claim": "첫 프로그램을 만드는 레슨 한복판에 SE11·SE80 투어 두 절(임베드 2개 포함)이 끼어들어 본론 흐름이 끊긴다. 본문 스스로 지금은 필요 없다고 인정하는 내용이다.",
      "evidence": "레슨 제목·direction과 챕터 objectives는 모두 'T-code와 SE38로 첫 프로그램을 생성·실행'인데, SE38 첫 화면 임베드 다음에 SE11(정식 도입은 CH03이라고 본문이 직접 밝힘)과 SE80(정식은 CH01-L06) 절이 연달아 오고 각각 화면 임베드까지 붙는다. 그러고 나서야 '이제 SE38로 돌아가 첫 프로그램을 만들어 보자'로 복귀한다. 인용한 문장처럼 본문이 스스로 '지금은 SE38 하나로 충분'하다고 말하므로, 이건 경력자에게만 지루한 게 아니라 입문자에게도 '이것도 지금 외워야 하나'라는 불필요한 부하다.",
      "suggestion": "두 절을 `<details>` 접기('지금은 위치만 — 열어보지 않아도 된다')로 내리거나, '데이터 설계도는 SE11, 여러 오브젝트를 한 트리로 보는 통합 작업장은 SE80 — 각각 CH03과 다음 레슨에서 실제로 쓴다' 두 줄 포인터로 압축하고 화면 임베드는 해당 레슨으로 이관한다. 명령창 → SE38 → 생성 → 개발 루프가 한 호흡으로 이어져야 한다."
    },
    {
      "seq": 5,
      "file": "C:\\SAP\\sap-dev-academy\\content\\abap\\CH01\\_chapter.md",
      "quote": "일단 **화면에 뭐라도 출력**해서 개발 루프(작성 → 활성화 → 실행)를 한 바퀴 돌려본다.",
      "category": "지름길 부재",
      "severity": "낮음",
      "confidence": "확실",
      "claim": "이미 개발 경험이 있는 독자가 어디를 훑고 어디에 시간을 써야 하는지 알려주는 안내가 챕터·레슨 어디에도 없다.",
      "evidence": "CH01에는 성격이 전혀 다른 두 종류가 같은 무게로 섞여 있다. 로그온 절차(L01), 마침표·주석·대소문자(L03)는 타 언어 경력자가 30초면 흡수하는 내용이고, $TMP와 이송 불가, 저장≠활성화, 이송요청 Request/Task, SE93 T-code는 SAP에만 있어 반드시 읽어야 하는 내용이다. 챕터 intro와 각 레슨 도입부 어디에도 '이미 개발 경험이 있다면 …' 류의 경로 안내가 없어, 경력자는 전부 같은 속도로 읽으며 답답해하거나 반대로 SAP 고유 함정까지 함께 건너뛴다.",
      "suggestion": "챕터 intro 끝에 한 줄이면 충분하다 — '다른 언어로 개발해 본 적이 있다면 L01·L03은 훑고 지나가도 된다. 대신 L02($TMP·활성화)·L06(이송요청)·L07(T-code)에 시간을 쓰자. ABAP만의 규칙은 거기 있다.' 입문자 동선에는 영향이 없고 경력자만 선택적으로 건너뛴다."
    },
    {
      "seq": 6,
      "file": "C:\\SAP\\sap-dev-academy\\content\\abap\\CH01\\CH01-L03.md",
      "quote": "실행형 프로그램은 [[REPORT]] 문으로 시작하고, 프로그램 이름을 적는다.",
      "category": "용어 충돌",
      "severity": "낮음",
      "confidence": "확실",
      "claim": "REPORT가 '보고서 기능'과 무관한 실행형 프로그램의 역사적 이름일 뿐이라는 점을 짚지 않아, 타 언어 경력자가 키워드의 적용 범위를 오해한다.",
      "evidence": "본문은 REPORT를 '이 프로그램은 실행형 리포트임을 선언한다'로만 설명한다. 일반 개발에서 report는 Crystal·Jasper 같은 리포팅 산출물을 가리키므로, 경력자는 '리포트가 아닌 일반 프로그램은 다른 키워드를 쓰나?', '출력이 없는 배치도 REPORT인가?'라는 의문을 안고 넘어간다. 실제로는 화면 출력이 전혀 없는 프로그램도 REPORT로 시작한다.",
      "suggestion": "괄호 한 줄이면 해소된다 — '여기서 Report는 보고서 기능이 아니라, 실행형 프로그램을 부르는 ABAP의 오래된 이름이다. 출력이 없는 프로그램도 REPORT로 시작한다.' 이 문장은 파일 머리에 종류와 이름을 밝히는 머리글에 가깝다고 덧붙이면 경력자가 바로 정착된다."
    },
    {
      "seq": 7,
      "file": "C:\\SAP\\sap-dev-academy\\content\\abap\\CH01\\CH01-L05.md",
      "quote": "- 숫자·날짜는 `NO-ZERO`·`DECIMALS`·`CURRENCY`·`DD/MM/YYYY` 같은 전용 옵션으로 다듬는다.",
      "category": "지름길 부재",
      "severity": "낮음",
      "confidence": "확실",
      "claim": "classic 리스트 서식 옵션을 한 레슨 가득 다루면서, 이게 실무 목록 출력의 최종형이 아니라 기본기라는 위치 안내가 학습자가 보는 본문에는 없다.",
      "evidence": "front-matter goals에는 '(classic 리스트 서식)'이라는 한정이 있지만 렌더링되는 본문에는 그 한정이 없다. 폭·정렬·COLOR 번호·INTENSIFIED·INVERSE·ULINE·SKIP·NO-ZERO·DECIMALS·CURRENCY까지 옵션 밀도가 높아서, 경력자는 '이 색 번호를 외워야 하나, 실무 화면도 이렇게 만드나'를 계속 자문하며 읽는다. 투자 대비 위치를 모르면 과잉 암기하거나 반대로 통째로 흘려보낸다.",
      "suggestion": "정리 끝에 코드 없는 예고 한 줄 — '여기 서식은 출력의 기본기다. 실무의 표 형태 목록은 나중에 배울 전용 도구(ALV)로 만든다. 지금은 폭·정렬·강조의 감만 잡으면 된다.' 이름과 시점만 언급하는 1～2문장이라 게이팅 규칙 안에서 소화된다."
    },
    {
      "seq": 8,
      "file": "C:\\SAP\\sap-dev-academy\\content\\abap\\CH01\\CH01-L07.md",
      "quote": "## 왜 T-code가 필요한가 — 사용자는 SE38을 못 쓴다",
      "category": "과잉",
      "severity": "낮음",
      "confidence": "확실",
      "claim": "짧은 레슨 안에서 T-code가 필요한 이유를 도입부와 이 절이 사실상 두 번 논증한다.",
      "evidence": "도입 절이 이미 '사용자에게 SE38을 열고 프로그램 이름을 입력하라고 시킬 수는 없다'로 동기를 세웠는데, SE93 실습을 마친 뒤 이 절이 같은 논지를 처음부터 다시 편다. 뒤 절에 새 정보(SE38 권한 자체가 없음, Area Menu·즐겨찾기 등록, Module Pool은 T-code 필수)가 있긴 하지만, 이미 설득되고 심지어 만들어까지 본 독자에겐 되돌아가는 느낌이라 짧은 레슨의 밀도가 떨어진다.",
      "suggestion": "반복되는 동기 문장을 걷어내고 새 정보만 남긴다 — '편의가 아니라 필수인 이유' 세 불릿(권한·메뉴 등록·Module Pool)으로 압축하거나, 이 내용을 도입부로 합치고 SE93 실습을 레슨 끝에 배치해 한 방향으로 흐르게 한다."
    }
  ],
  "overall": {
    "grade_opinion": "경미 수정",
    "summary": "CH01은 사실관계와 순서 모두 안정적이다. /n·/o 접두어의 실제 동작, $TMP가 비공개가 아니라 이송 불가라는 선제 해명, 저장≠활성화, CURRENCY가 표시 자릿수를 바꾸는 이유처럼 SAP 초심자가 실제로 걸리는 지점을 정확히 짚었고 틀린 서술은 찾지 못했다. 타 언어 경력자 시선의 아쉬움은 세 갈래다. ① 용어 충돌을 짚지 않는다 — 한 화면 안에서 client(접속 프로그램)와 Client(테넌트)가 부딪히고, 큰따옴표가 문자열이 아니라 주석이라는 최대 함정이 리터럴 절에 없으며, REPORT가 보고서와 무관하다는 안내도 없다. ② 서버 공유라는 ABAP의 본질이 활성화 설명에서 빠져 로컬 빌드로 오독될 여지가 있다. ③ 경로 안내가 없어 훑어도 되는 곳(L01·L03)과 반드시 읽어야 할 SAP 고유 규칙이 같은 무게로 놓여 있다. 분량 자체는 1독자인 입문자 기준으로 과하지 않으며, 다만 CH01-L02의 SE11·SE80 투어는 입문자에게도 첫 프로그램 흐름을 끊는 군더더기다. 전체적으로 재집필이 아니라 한 줄짜리 경고·주석 몇 개 추가와 한 챕터 내 절 이동으로 해결되는 수준이다."
  }
}
