{"agent":"AG01","model":"gpt-5.6-sol","target":"CH20","persona_ack":"개발·전공 경험이 없는 24세 문과 출신 입문자 ‘은서’의 시선으로, 레슨을 순서대로 읽으며 멈춤·생략·단절·과부하 지점을 감사했다.","method":"PowerShell Get-Content로 지정된 8개 Markdown 파일만 UTF-8 원문 통독하고, 챕터 내부의 선행 설명·실습 데이터·예상 결과와 대조했다.","errors":[],"files_read":["C:\\SAP\\sap-dev-academy\\content\\abap\\CH20\\CH20-L01.md","C:\\SAP\\sap-dev-academy\\content\\abap\\CH20\\CH20-L02.md","C:\\SAP\\sap-dev-academy\\content\\abap\\CH20\\CH20-L03.md","C:\\SAP\\sap-dev-academy\\content\\abap\\CH20\\CH20-L04.md","C:\\SAP\\sap-dev-academy\\content\\abap\\CH20\\CH20-L05.md","C:\\SAP\\sap-dev-academy\\content\\abap\\CH20\\CH20-L06.md","C:\\SAP\\sap-dev-academy\\content\\abap\\CH20\\CH20-L07.md","C:\\SAP\\sap-dev-academy\\content\\abap\\CH20\\_chapter.md"],"findings":[{"seq":1,"file":"C:\\SAP\\sap-dev-academy\\content\\abap\\CH20\\CH20-L02.md","quote":"정본 잔여석 계산은 **회차별**이다(정원은 공연 단위, 소진은 회차별 —","category":"단절","severity":"중간","confidence":"확실","claim":"CTE를 처음 익히는 도중 ‘회차’, ‘정본’, ‘소진’이라는 새로운 업무 개념이 설명 없이 한꺼번에 등장한다.","evidence":"앞부분은 공연 단위 합산만 설명했는데, 갑자기 공연과 회차의 관계 및 ‘정본 잔여석’ 기준을 제시한다. 회차가 공연과 어떻게 다른지 몰라 주의문의 의미를 이해하려면 외부 챕터로 이동해야 한다.","suggestion":"공연 하나에 날짜·시간별 여러 회차가 있을 수 있다는 한 줄 예시를 먼저 넣고, 이 레슨에서는 CTE 문법에 집중해 공연 단위로 단순화한다는 뜻을 풀어 쓴다."},{"seq":2,"file":"C:\\SAP\\sap-dev-academy\\content\\abap\\CH20\\CH20-L07.md","quote":"SELECT c~concert_id, c~artist, c~capacity,","category":"단절","severity":"높음","confidence":"확실","claim":"실습 데이터에 없는 `artist` 컬럼을 조회해, 제시된 표를 기준으로는 코드를 실행하거나 결과를 추론할 수 없다.","evidence":"같은 레슨의 `zconcert` 표에는 `concert_id`, `title`, `capacity`만 있다. 입문자는 `artist`가 오타인지 숨겨진 실제 테이블 컬럼인지 판단할 수 없으며, 표와 같은 구조로 실습하면 존재하지 않는 컬럼 오류가 난다.","suggestion":"조회 컬럼을 `c~title`로 고치거나 실습 데이터 표의 `title`을 `artist`로 통일한다."},{"seq":3,"file":"C:\\SAP\\sap-dev-academy\\content\\abap\\CH20\\CH20-L07.md","quote":"1. 과제 1의 CTE에서 `WHERE status <> 'C'`를 빼 보고, 취소 예약이 합계에 섞이는지 확인한다.","category":"생략","severity":"중간","confidence":"확실","claim":"직접 해 볼 세 과제에 정답 또는 최소 검산 기준이 없어, 초보자가 변경 결과를 제대로 해석했는지 확인할 수 없다.","evidence":"본문은 결과를 눈대중으로 넘기지 말고 계산값을 확인하라고 강조하지만, 직접 과제에는 변경 후 예상 행과 값이 없다. 예를 들어 이 과제에서는 C002가 booked 1, remaining 49가 되어야 하는데 학습자가 이를 대조할 수 없다.","suggestion":"접을 수 있는 정답 영역에 각 과제의 예상 결과를 제공한다. 과제 2는 C001 중복, 과제 3은 좌우 반전 시 빈 결과가 된다는 점도 명시한다."}],"overall":{"grade_opinion":"보강 권장","summary":"CTE·EXISTS·집합·Window를 입력표와 예상 결과로 반복해 보여 주는 장치는 특히 잘 읽혔다. 다만 회차 개념의 갑작스러운 등장, 실습 스키마와 코드의 컬럼 불일치, 직접 과제의 검산 답안 부재는 입문자의 실습 흐름을 끊으므로 보강이 필요하다."}}