{"agent":"AG05","model":"gpt-5.6-sol","target":"CH08","persona_ack":"20년차 학습 교재·코스 설계 전문가 관점에서 비전공 20대 입문자의 동기, 개념 순서, 복습·예습 장치와 인지 부하를 감사했다.","method":"PowerShell Get-Content로 지정된 8개 Markdown 파일만 UTF-8 원문으로 읽고, 챕터 및 레슨 간 교수설계 흐름을 대조했다. 외부 검색과 파일 변경은 하지 않았다.","errors":[],"files_read":["C:\\SAP\\sap-dev-academy\\content\\abap\\CH08\\CH08-L01.md","C:\\SAP\\sap-dev-academy\\content\\abap\\CH08\\CH08-L02.md","C:\\SAP\\sap-dev-academy\\content\\abap\\CH08\\CH08-L03.md","C:\\SAP\\sap-dev-academy\\content\\abap\\CH08\\CH08-L04.md","C:\\SAP\\sap-dev-academy\\content\\abap\\CH08\\CH08-L05.md","C:\\SAP\\sap-dev-academy\\content\\abap\\CH08\\CH08-L06.md","C:\\SAP\\sap-dev-academy\\content\\abap\\CH08\\CH08-L07.md","C:\\SAP\\sap-dev-academy\\content\\abap\\CH08\\_chapter.md"],"findings":[{"seq":1,"file":"C:\\SAP\\sap-dev-academy\\content\\abap\\CH08\\_chapter.md","quote":"저장한 데이터를 다시 읽어오고 싶다.","category":"챕터 도입·동기 설계","severity":"중간","confidence":"확실","claim":"챕터 소개가 학습자의 바람을 한 문장으로 반복할 뿐, 읽지 못할 때의 실제 불편과 챕터를 마친 뒤 할 수 있는 일을 보여 주지 않아 CH08의 학습 가치를 충분히 판매하지 못한다.","evidence":"본문에는 SELECT 형태, INTO 대상, WHERE, 인덱스, 빈 결과 처리까지 일곱 레슨이 있지만 챕터 소개에서는 이 진행 경로와 최종 수행 능력을 전혀 예고하지 않는다. 첫 진입 시 학습 범위와 보상을 가늠할 단서가 없다.","suggestion":"저장했지만 프로그램에서 활용할 수 없는 불편을 한 장면으로 제시하고, ‘필요한 행과 컬럼을 골라 프로그램에 담고 빈 결과까지 처리한다’는 최종 성과 및 2~3단계 학습 경로를 짧게 덧붙인다."},{"seq":2,"file":"C:\\SAP\\sap-dev-academy\\content\\abap\\CH08\\CH08-L05.md","quote":"`WHERE`로 필요한 행만 추린다. 비교할 값을 ABAP 변수에 담아 두고 그 변수를 조건에 그대로\n적을 수 있다. 이렇게 SQL 문장 안에 끼워 쓰는 ABAP 변수를 **host 변수**라 부른다.","category":"인지 부하·레슨 범위","severity":"중간","confidence":"확실","claim":"한 레슨에서 host 변수, 비교 연산자와 약어, AND·OR·NOT, BETWEEN·IN·LIKE, wildcard, NULL과 DDIC 초기값 차이까지 연속 도입해 초급자의 신규 개념 묶음이 과다하다.","evidence":"단순 WHERE 연산자 실습에 더해 SQL Injection 설명과 아직 실제 업무 테이블에서 결과가 나오지 않는 IS NULL, 향후 OUTER JOIN 예고까지 포함된다. 핵심인 조건 조합 연습과 주변 개념의 우선순위가 경쟁한다.","suggestion":"이 레슨은 비교·논리·범위·패턴 조건의 조합에 집중하고, host 변수의 보안 설명은 짧은 보충 상자로 축소한다. IS NULL은 실제 NULL이 나타나는 OUTER JOIN 레슨으로 옮기거나 선택형 선행 읽기로 분리한다."},{"seq":3,"file":"C:\\SAP\\sap-dev-academy\\content\\abap\\CH08\\CH08-L06.md","quote":"> 이 레슨에서 가져갈 결론은 하나다. **이 과정 실습 환경에서 보조 인덱스를 직접 만들 일은\n> 거의 없다.**","category":"레슨 순서·학습 우선순위","severity":"중간","confidence":"확실","claim":"초급 읽기 흐름이 완성되기 전에 직접 사용할 일이 거의 없는 Secondary Index와 HANA 차이를 다루고, 더 기본적인 빈 결과 처리를 다음 레슨으로 미룬 순서는 학습 우선순위가 뒤집혀 있다.","evidence":"L07은 L02만을 선수로 요구하며 SELECT 결과가 없을 때의 분기를 가르친다. 반면 L06은 CH35에서 정식으로 다룰 측정·튜닝 판단까지 예고하며, 본문 스스로 현 실습에서 인덱스를 만들 일이 거의 없다고 밝힌다.","suggestion":"L07의 빈 결과 처리를 WHERE 직후로 앞당겨 기본 조회 흐름을 먼저 완성한다. L06은 챕터 말미의 선택형 성능 맛보기로 명시하거나, 실제 대량 조회·측정이 가능한 후속 성능 챕터로 옮긴다."},{"seq":4,"file":"C:\\SAP\\sap-dev-academy\\content\\abap\\CH08\\CH08-L07.md","quote":"그런데 방금 읽어 온 그 값은 우리가 SE11 화면에서 **손으로 한 자씩 쳐 넣은** 것이다. 그때\n`DAN`에 엉뚱한 숫자를 넣어도 시스템은 아무 말이 없었고, 없는 값이 그대로 저장됐다.","category":"다음 학습 예고","severity":"낮음","confidence":"확실","claim":"레슨 말미의 다음 챕터 예고가 1~2문장을 넘어 새 문제, F4, Foreign Key, Check Table, 프로젝트 소재 변경까지 설명해 현재 챕터의 회고와 종료감을 약화한다.","evidence":"CH08 전체 성장 회고 뒤에 다음 챕터의 문제 상황과 해결 개념을 여러 문장으로 먼저 풀고, 이어 콘서트 예매 앱 전환까지 별도 문단으로 안내한다. 다음 학습에 필요한 호기심 유발 수준보다 선행 설명이 길다.","suggestion":"CH08 성취 회고를 유지하되 다음 예고는 ‘잘못된 입력을 저장 전에 막으려면?’이라는 질문과 ‘다음에는 F4와 Foreign Key로 해결한다’는 답 정도로 압축한다. 프로젝트 소재 변경 안내는 CH09 도입으로 옮긴다."}],"overall":{"grade_opinion":"보강 권장","summary":"각 레슨은 대체로 ‘필요성→개념→예제→실수→다음 예고’를 갖추고, 이전 챕터의 ZGUGUDAN과 Internal Table을 재사용하는 상기도 양호하다. 다만 챕터 소개가 지나치게 얇고, WHERE 레슨의 신규 개념 밀도가 높으며, 기본 빈 결과 처리보다 인덱스·HANA 설명이 먼저 배치되어 초급 학습 우선순위가 흐려진다. 소개 보강, L05 범위 축소, L06·L07 순서 조정과 마지막 예고 압축을 권장한다."}}