{
  "agent": "AG03",
  "model": "sonnet",
  "target": "CH06",
  "persona_ack": "타 언어(Java/C#) 백엔드 3～5년차 개발자 페르소나로 CH06(_chapter.md, L01～L06) 전문을 통독하며 과잉 설명·오개념 유발·지름길 부재·용어 충돌 네 관점에서 검토함. 채택 기준에 따라 '입문자에게도 불필요한 장황함'만 높음 이상으로 분류하고, '입문자에겐 필요하나 경력자는 이미 아는 내용'은 낮음 또는 suggestion으로 낮춰 판단함.",
  "method": "Read 도구로 대상 파일 7개(전체 경로 그대로)를 순서대로 전문 통독. 외부 검색·타 감사자 산출물·과거 감사 산출물 참조 없이 페르소나 관점의 단일 통독만으로 판단. 인용문은 각 파일에서 grep으로 원문과 정확히 일치하는지 재확인 후 채택.",
  "errors": [],
  "files_read": [
    "C:\\SAP\\sap-dev-academy\\content\\abap\\CH06\\_chapter.md",
    "C:\\SAP\\sap-dev-academy\\content\\abap\\CH06\\CH06-L01.md",
    "C:\\SAP\\sap-dev-academy\\content\\abap\\CH06\\CH06-L02.md",
    "C:\\SAP\\sap-dev-academy\\content\\abap\\CH06\\CH06-L03.md",
    "C:\\SAP\\sap-dev-academy\\content\\abap\\CH06\\CH06-L04.md",
    "C:\\SAP\\sap-dev-academy\\content\\abap\\CH06\\CH06-L05.md",
    "C:\\SAP\\sap-dev-academy\\content\\abap\\CH06\\CH06-L06.md"
  ],
  "findings": [
    {
      "seq": 1,
      "file": "C:\\SAP\\sap-dev-academy\\content\\abap\\CH06\\CH06-L02.md",
      "quote": "- **이진 탐색** — 정렬된 전화번호부를 딱 반으로 갈라",
      "category": "과잉",
      "severity": "낮음",
      "confidence": "확실",
      "claim": "이진 탐색·해시 개념을 전화번호부·계산 비유로 한 문단씩 풀어 설명하는데, 3～5년차 백엔드 개발자에게는 이미 확실히 아는 CS 기초라 장황하게 느껴진다.",
      "evidence": "L02 '③ Table Kind' 절이 표를 낸 직후 '표에 처음 나온 두 낱말부터 풀어 둔다'며 이진 탐색·해시 각각을 비유로 새로 설명한다. 두 개념 모두 알고리즘 기초 과정에서 다루는 표준 개념이다.",
      "suggestion": "이 사이트의 1순위 독자는 비전공 입문자이므로 설명 자체는 유지하되, 문단 앞에 '이진 탐색·해시를 이미 안다면 이 두 문단은 건너뛰어도 된다' 같은 한 줄 스킵 안내를 붙이면 경력자는 바로 다음 절로 넘어갈 수 있다."
    },
    {
      "seq": 2,
      "file": "C:\\SAP\\sap-dev-academy\\content\\abap\\CH06\\CH06-L02.md",
      "quote": "- STANDARD·SORTED는 **Index Table**이다. 행마다 번호가 붙어",
      "category": "용어 충돌",
      "severity": "중간",
      "confidence": "추정",
      "claim": "'Index Table'이라는 이름 때문에 경력자는 반사적으로 '색인이 있어 탐색이 빠른 테이블'로 오해하기 쉽다. 그런데 바로 위 표를 보면 STANDARD(=Index Table)의 키 탐색은 '순차'로 셋 중 가장 느리고, 오히려 Index Table이 아닌 HASHED가 가장 빠른 단건 탐색이다.",
      "evidence": "같은 레슨의 Table Kind 표(STANDARD='입력 순서 유지, 키 탐색은 순차' / HASHED='해시로 단건 탐색(행 수와 무관)')와 인용문을 나란히 보면, 'Index'라는 이름이 붙은 종류가 탐색 성능에서는 오히려 가장 불리하다. 즉 이 챕터의 'Index'는 '번호로 위치 접근이 되는가'만 뜻하고 탐색 속도와는 무관한데, 그 구분이 본문에 명시적으로 짚어져 있지 않다.",
      "suggestion": "Index Table을 정의하는 문장 옆에 '여기서 인덱스는 탐색 속도가 아니라 번호로 위치 접근이 되는가만 뜻한다. 탐색 속도는 위 표를 따로 봐야 한다' 같은 한 줄을 더하면 이름에서 오는 성능 오해를 막을 수 있다."
    },
    {
      "seq": 3,
      "file": "C:\\SAP\\sap-dev-academy\\content\\abap\\CH06\\CH06-L04.md",
      "quote": "`COLLECT`는 **키가 같은 행이 이미 있으면 숫자 필드를 합산**하고, 없으면 새 행으로 넣는다.",
      "category": "용어 충돌",
      "severity": "낮음",
      "confidence": "추정",
      "claim": "Java 3～5년차라면 `Stream.collect(...)`가 매우 익숙하다. Java의 collect는 어떤 Collector를 넘기느냐에 따라 동작이 자유로운 범용 종단 연산(단순히 리스트로 모으는 것도 가능)인 반면, ABAP `COLLECT`는 이름은 같지만 '키가 같으면 숫자 필드를 합산'이라는 단 하나의 고정된 동작만 한다. 이름만 보고 '그냥 모아 담는 것'으로 짐작하면 실제로는 합산이 일어나 당황할 수 있다.",
      "evidence": "인용 문장 자체는 동작을 곧바로 명확히 밝히지만, Java Stream.collect와 이름이 같다는 점에 대한 언급은 챕터 어디에도 없다. L06 '다른 언어를 해 봤다면' 절도 COLLECT를 SQL GROUP BY와만 비교하고 Java Stream.collect와는 비교하지 않는다.",
      "suggestion": "'Java의 Stream.collect()와 이름은 같지만 ABAP COLLECT는 언제나 키 기준 합산 하나만 한다'는 한 줄을 덧붙이면 동명이의어 함정을 미리 막을 수 있다."
    },
    {
      "seq": 4,
      "file": "C:\\SAP\\sap-dev-academy\\content\\abap\\CH06\\CH06-L04.md",
      "quote": "- **LOOP 도는 중에 그 테이블에 행 추가·삭제** → 순회가 행을 건너뛰거나 꼬일 수 있다.",
      "category": "오개념 유발",
      "severity": "중간",
      "confidence": "추정",
      "claim": "Java 개발자는 컬렉션을 순회하며 구조를 바꾸면 ConcurrentModificationException처럼 즉시·시끄럽게 실패하는 데 익숙하다. 이 문장은 ABAP LOOP 중 행 추가/삭제가 '건너뛰거나 꼬일 수 있다'는 결과만 알려줄 뿐, 런타임 오류 없이 조용히 틀린 결과를 낸다는 대조는 짚지 않는다. '에러가 안 나면 괜찮다'는 습관을 가진 경력자가 이 위험을 과소평가할 수 있다.",
      "evidence": "해당 문장은 결과만 서술하고 원인(예외로 걸러지지 않는다는 점)은 언급하지 않는다. Java의 fail-fast 반복자와 달리 ABAP LOOP는 이런 상황에서 명시적인 런타임 오류(dump)를 던지지 않는다.",
      "suggestion": "'Java의 ConcurrentModificationException처럼 즉시 에러가 나지 않고, 조용히 틀린 결과만 낸다'는 한 문장을 덧붙이면 경력자가 이 경고를 가볍게 넘기지 않게 된다."
    },
    {
      "seq": 5,
      "file": "C:\\SAP\\sap-dev-academy\\content\\abap\\CH06\\CH06-L06.md",
      "quote": "- **STANDARD / SORTED / HASHED** — 순서대로 담는 리스트 / 키 순서가 유지되는 맵 /",
      "category": "지름길 부재",
      "severity": "낮음",
      "confidence": "확실",
      "claim": "Java/C#·SQL 대응 비유(STANDARD/SORTED/HASHED = List/TreeMap/HashMap, COLLECT = GROUP BY, ASSIGNING <fs> = 참조, sy-subrc = 반환코드)가 챕터 맨 끝 L06의 접힌 <details> 블록에만 몰려 있고, 그 개념이 처음 등장하는 L02(Table Kind)·L03(sy-subrc)·L04(COLLECT)에는 없다.",
      "evidence": "L02는 STANDARD/SORTED/HASHED를 저장·탐색 방식 표로만 설명하고 언어 비유가 없다. L04의 COLLECT 절도 절차 설명뿐이다. 같은 비유가 L06 '다른 언어를 해 봤다면' 절(기본 접힘 상태)에 처음 등장한다. 처음부터 순서대로 읽는 경력자는 L02～L05 동안 비유 없이 읽다가 챕터 끝에서야 대응 관계를 알게 된다.",
      "suggestion": "L02·L03·L04 각 개념 첫 등장 자리에 짧은 괄호 비유(예: 'Java/C#의 List/TreeMap/HashMap과 유사 — 자세한 대조는 챕터 끝 참고')를 추가하거나, 최소한 L02 도입부에 '챕터 끝에 다른 언어 대조표가 있다'는 안내를 한 번 넣으면 좋다."
    }
  ],
  "overall": {
    "grade_opinion": "경미 수정",
    "summary": "CH06은 경력 개발자 관점을 이미 상당히 신경 쓴 챕터다 — L01의 'APPEND는 참조가 아니라 값 복사'(Java/C# 대조) 콜아웃, L06의 접이식 '다른 언어를 해 봤다면' 대조표가 대표적이다. 다만 다섯 가지 국소적 다듬기 여지가 있다. ① 이진 탐색·해시 설명은 입문자에겐 필요하지만 경력자에겐 장황하다(낮음, 스킵 안내 제안). ② 'Index Table'이라는 이름이 '탐색이 빠른 테이블'로 오해되기 쉬운데, 실제로는 STANDARD(Index Table)가 셋 중 탐색이 가장 느리고 HASHED(비-Index Table)가 가장 빠르다(중간). ③ ABAP COLLECT와 Java Stream.collect는 이름만 같고 동작이 다르다는 언급이 없다(낮음). ④ LOOP 중 행 추가·삭제 경고가 결과만 말할 뿐 'Java처럼 즉시 예외가 나지 않고 조용히 틀린다'는 대조가 없어 경력자가 위험을 과소평가할 수 있다(중간). ⑤ Java/C#·SQL 대응 비유가 챕터 끝 L06에만 몰려 있어 L02～L04를 순서대로 읽는 동안은 그 도움을 못 받는다(낮음). 구조적 결함은 없고 findings는 모두 문구 추가·재배치 수준의 보완 제안이다."
  }
}
