{
  "agent": "AG01",
  "model": "sonnet",
  "target": "CH02",
  "persona_ack": "은서 — 24세, 인문계 출신, 개발·전공 경험 없음. CH02를 _chapter.md→L01→L02→L03→L04→L05→L06 순서로, 처음 읽는 사람 입장에서 통독하며 막히는 지점을 그때그때 기록했다.",
  "method": "",
  "errors": [],
  "files_read": [
    "C:\\SAP\\sap-dev-academy\\content\\abap\\CH02\\CH02-L01.md",
    "C:\\SAP\\sap-dev-academy\\content\\abap\\CH02\\CH02-L02.md",
    "C:\\SAP\\sap-dev-academy\\content\\abap\\CH02\\CH02-L03.md",
    "C:\\SAP\\sap-dev-academy\\content\\abap\\CH02\\CH02-L04.md",
    "C:\\SAP\\sap-dev-academy\\content\\abap\\CH02\\CH02-L05.md",
    "C:\\SAP\\sap-dev-academy\\content\\abap\\CH02\\CH02-L06.md",
    "C:\\SAP\\sap-dev-academy\\content\\abap\\CH02\\_chapter.md"
  ],
  "findings": [
    {
      "seq": 1,
      "file": "CH02-L01.md",
      "quote": "따옴표 리터럴로는 안 된다.",
      "category": "생략",
      "severity": "낮음",
      "confidence": "확실",
      "claim": "챕터 전체의 첫 용어인 '리터럴'이 등장하는 자리(도입부 소제목 '리터럴의 한계' 포함)에 정작 뜻풀이가 없다.",
      "evidence": "L01 도입부에 '리터럴'이 두 번(소제목, 본문) 나오지만 둘 다 [[ ]] 글로서리 마킹이 없다. 첫 [[리터럴]] 마킹은 CH02-L02에 가서야 나온다. 바로 앞 문장('값을 따옴표에 직접 적었다')으로 대략 유추는 되지만 공식 풀이·팝업은 아직 없다.",
      "suggestion": "L01의 첫 등장 자리에 '리터럴(코드에 직접 적은 값)'처럼 괄호 풀이를 붙이거나 [[리터럴]] 마킹을 이 위치로 앞당긴다."
    },
    {
      "seq": 2,
      "file": "CH02-L01.md",
      "quote": "DATA gv_tag TYPE c LENGTH 1 VALUE 'X'.",
      "category": "단절",
      "severity": "중간",
      "confidence": "확실",
      "claim": "VALUE 초기값을 설명하는 예제에 C 타입과 LENGTH 지정이 아무 설명 없이 등장한다. C·LENGTH는 두 레슨 뒤(CH02-L03, Incomplete 타입)에서야 정식으로 배운다.",
      "evidence": "L01 front-matter의 introduces에는 'C 타입'·'LENGTH'가 없다(정식 introduces는 L03). gv_tag·'X'로 '문자 하나'라는 감은 오지만, 왜 c이고 왜 LENGTH가 필요한지는 이 레슨 어디에도 없다.",
      "suggestion": "이 줄을 빼고 이미 배운 gv_qty(TYPE i VALUE 10)만 남기거나, 남긴다면 '[선행 사용] C·LENGTH는 다음다음 레슨에서 배운다' 각주를 붙인다."
    },
    {
      "seq": 3,
      "file": "CH02-L01.md",
      "quote": "DATA gv_price TYPE p LENGTH 8 DECIMALS 2.",
      "category": "단절",
      "severity": "높음",
      "confidence": "확실",
      "claim": "LIKE 문법을 보여주는 예제인데, 정작 예제에 쓰인 P·LENGTH·DECIMALS 자체가 아직 배우지 않은 문법이라 '왜 8이고 왜 2인지' 짐작할 단서가 이 줄엔 전혀 없다.",
      "evidence": "이 줄에는 주석조차 없다(바로 아래 LIKE 줄에만 주석이 있음). P·LENGTH·DECIMALS의 정식 설명(바이트 칸·부호 자리 포함)은 CH02-L03에서야 나온다. LIKE 개념 자체는 이해되지만, 예제 안 타입 표기가 새로운 미해결 물음으로 남는다.",
      "suggestion": "LIKE 예제를 이미 배운 TYPE i 계열로 바꾸거나, P 타입 부분에 '지금은 몰라도 됨' 각주를 단다."
    },
    {
      "seq": 4,
      "file": "CH02-L02.md",
      "quote": "DATA gv_price TYPE p LENGTH 8 DECIMALS 2.",
      "category": "단절",
      "severity": "중간",
      "confidence": "확실",
      "claim": "같은 레슨 안에서도 'P'라는 이름이 나오기 전에 P 타입 코드가 먼저 등장한다. 'P(packed) 타입'이라는 이름은 이 예제보다 뒤에 있는 '정수 연산의 함정' 섹션에서 처음 언급된다.",
      "evidence": "레슨 안 섹션 순서: (1) 숫자를 적는 법 — TYPE p LENGTH 8 DECIMALS 2 코드 등장 → (2) 정수 연산의 함정 — '다음 레슨의 P(packed) 타입이 필요하다'로 처음 이름이 나옴. 이름도 모르는 타입을 코드로 먼저 마주친다.",
      "suggestion": "이 예제도 TYPE i처럼 이미 배운 타입으로 바꾸거나, 'P 타입 이름 언급'을 이 예제보다 앞으로 옮긴다."
    },
    {
      "seq": 5,
      "file": "CH02-L03.md",
      "quote": "담을 수 있는 숫자는 최대 **15자리**(= 8×2−1, 소수 자릿수",
      "category": "과부하",
      "severity": "중간",
      "confidence": "추정",
      "claim": "Incomplete 타입 개념 + C/N/P 3종 + P의 바이트 내부 구조(칸·부호 자리·8×2−1 공식)가 한 레슨, 그것도 한 문단 안에 몰려 있어 방금 C·N·P를 처음 본 사람에겐 소화가 벅차다.",
      "evidence": "바로 앞에서 'P의 LENGTH는 글자 수가 아니라 칸(바이트) 수'라는 새 규칙을 배우자마자, 부호 자리·8×2−1 공식까지 한 문단에 압축돼 있다. 뒤이어 offset/length 부분 접근이라는 또 다른 새 개념도 같은 레슨에 이어진다. 다행히 뒤에 '길이 칸 실험실' 위젯이 있어 체험으로 완화되긴 한다.",
      "suggestion": "바이트 내부 구조·공식 설명을 위젯 체험 뒤로 옮기거나, 본문엔 'LENGTH 8 ≈ 최대 15자리' 결론만 먼저 주고 공식은 심화 각주로 뺀다."
    },
    {
      "seq": 6,
      "file": "CH02-L05.md",
      "quote": "지금은 클래스의 `CONSTANTS`가 그 자리를 대신한다(Type Group은 구식)",
      "category": "생략",
      "severity": "낮음",
      "confidence": "확실",
      "claim": "CH02까지 한 번도 나온 적 없는 '클래스(객체지향)' 개념을 풀이 없이 사용한다.",
      "evidence": "'클래스'는 [[ ]] 마킹이 없고, 지금까지 읽은 어떤 레슨에도 정의가 없다. 다만 '옛 코드에서' 트리비아 콜아웃이고 저자도 '정도로 읽으면 된다'고 가볍게 말해, 학습 흐름 자체를 막지는 않는다.",
      "suggestion": "'클래스(객체를 만드는 설계도, 뒤에서 배움)'처럼 짧은 괄호 풀이를 붙이거나 이 문장을 생략한다."
    }
  ],
  "overall": {
    "grade_opinion": "경미 수정",
    "summary": "불편→해결책 전개와 '흔한 실수와 점검' 정리가 일관돼 있어 전체 흐름은 잘 따라갔고, 그중에서도 CH02-L04의 'TYPES=도면, 변수=실물' 비유가 추상적인 타입 정의 개념을 가장 잘 이해시켰다. 다만 Incomplete 타입(C·N·P)이 정식 도입(L03)되기 전에 L01·L02 예제 코드에서 설명 없이 세 차례 먼저 등장해 그때마다 멈췄고, L03의 P 바이트/부호 공식은 한 문단에 정보가 몰려 곱씹어야 했다. '리터럴'·'클래스' 같은 용어도 첫 등장 자리엔 풀이가 비어 있었다."
  }
}
