{
  "agent": "AG01",
  "model": "sonnet",
  "target": "CH20",
  "persona_ack": "은서 — 개발·전공 경험 없는 24세 문과 출신 입문자. 노션·인스타에 익숙하고 모르는 단어가 나오면 그 자리에서 멈추는 성격으로, CH20 레슨을 CH20-L01부터 L07까지 순서대로 처음 읽는 사람처럼 통독했다.",
  "method": "",
  "errors": [],
  "files_read": [
    "C:\\SAP\\sap-dev-academy\\content\\abap\\CH20\\CH20-L01.md",
    "C:\\SAP\\sap-dev-academy\\content\\abap\\CH20\\CH20-L02.md",
    "C:\\SAP\\sap-dev-academy\\content\\abap\\CH20\\CH20-L03.md",
    "C:\\SAP\\sap-dev-academy\\content\\abap\\CH20\\CH20-L04.md",
    "C:\\SAP\\sap-dev-academy\\content\\abap\\CH20\\CH20-L05.md",
    "C:\\SAP\\sap-dev-academy\\content\\abap\\CH20\\CH20-L06.md",
    "C:\\SAP\\sap-dev-academy\\content\\abap\\CH20\\CH20-L07.md",
    "C:\\SAP\\sap-dev-academy\\content\\abap\\CH20\\_chapter.md"
  ],
  "findings": [
    {
      "seq": 1,
      "file": "CH20-L06.md",
      "quote": "CDS·RAP·동적 SQL이면 해당 장으로",
      "category": "단절",
      "severity": "높음",
      "confidence": "확실",
      "claim": "리뷰 체크리스트 표에 '동적 SQL'이라는 용어가 아무런 풀이·링크 없이 툭 나와서, 이게 뭔지 몰라 그 줄에서 멈췄다.",
      "evidence": "같은 셀에 나란히 있는 CDS와 RAP는 이 챕터 안(CH20-L01의 CDS·RAP 문단, CH20-L07의 DML/CDS/RAP 언급)에서 이미 한 번씩 나오고 원어 풀이나 다음 챕터 링크(CH23-L01, CH25-L01)까지 붙어 있는데, '동적 SQL'은 CH20 전체를 통틀어 이 표 한 칸이 유일한 등장이다. 괄호 풀이도, [[ ]] 용어 마킹도, 다음 장 링크도 없어서 몇 번을 다시 읽어도 무슨 뜻인지 알 방법이 없다.",
      "suggestion": "CDS·RAP처럼 '동적 SQL(실행 시점에 SQL 문장을 조립하는 기법)'처럼 짧은 괄호 풀이를 달거나, 다룰 예정인 챕터로 링크를 걸어 최소한의 방향을 준다."
    },
    {
      "seq": 2,
      "file": "CH20-L03.md",
      "quote": "ABAP 공식 keyword 문서도 긴 컬럼 목록 대신 값 하나만 쓰라고 권한다.",
      "category": "멈춘 곳",
      "severity": "낮음",
      "confidence": "확실",
      "claim": "'ABAP 공식 keyword 문서'가 정확히 무엇이고 어디서 볼 수 있는지 알려주지 않아서, 이걸 찾아봐야 하나 싶어 잠깐 멈칫했다.",
      "evidence": "바로 앞 문장이 '어떤 컬럼을 고르는지는 결과에 영향을 주지 않는다'고 이미 설명해 줘서 내용 자체를 이해하는 데는 지장이 없었지만, 이름도 링크도 없는 '공식 문서'를 근거로 갑자기 들이대니 나 같은 입문자는 그 문서를 못 봤으니 확인할 방법이 없어 붕 뜬 느낌이었다.",
      "suggestion": "구체적 문서명·링크를 밝히거나, 근거 인용이 꼭 필요하지 않다면 이 문장은 빼고 앞 문장 설명만으로 마무리해도 충분하다."
    }
  ],
  "overall": {
    "grade_opinion": "경미 수정",
    "summary": "CTE·EXISTS·EXCEPT·Window 네 레슨 모두 결과를 바로 보여주지 않고 손으로 예상 표를 먼저 그려보게 한 뒤(L02·L04·L05) 실제 결과와 맞춰보게 하는 검증 습관, 그리고 L07의 자체 검산 힌트가 특히 잘 읽혔다. 다만 L06 체크리스트의 '동적 SQL'처럼 이 챕터에서 한 번도 다루지 않은 용어가 풀이·링크 없이 불쑥 등장하는 지점은 짚고 넘어갈 필요가 있다."
  }
}
