{"agent":"AG01","model":"gpt-5.6-sol","target":"CH12","persona_ack":"개발·전공 경험이 없는 24세 문과 출신 입문자 ‘은서’의 시선으로, CH12 레슨을 L01부터 L07과 챕터 소개까지 순서대로 통독했다.","method":"PowerShell Get-Content를 UTF-8 인코딩으로 사용해 지정된 8개 Markdown 파일만 읽고, 같은 챕터의 앞선 설명만으로 용어와 논리를 따라갈 수 있는지 점검했다.","errors":[],"files_read":["C:\\SAP\\sap-dev-academy\\content\\abap\\CH12\\CH12-L01.md","C:\\SAP\\sap-dev-academy\\content\\abap\\CH12\\CH12-L02.md","C:\\SAP\\sap-dev-academy\\content\\abap\\CH12\\CH12-L03.md","C:\\SAP\\sap-dev-academy\\content\\abap\\CH12\\CH12-L04.md","C:\\SAP\\sap-dev-academy\\content\\abap\\CH12\\CH12-L05.md","C:\\SAP\\sap-dev-academy\\content\\abap\\CH12\\CH12-L06.md","C:\\SAP\\sap-dev-academy\\content\\abap\\CH12\\CH12-L07.md","C:\\SAP\\sap-dev-academy\\content\\abap\\CH12\\_chapter.md"],"findings":[{"seq":1,"file":"C:\\SAP\\sap-dev-academy\\content\\abap\\CH12\\CH12-L04.md","quote":"1. **포함(I) 행 중 하나라도** 맞으면 후보가 된다(OR처럼 후보를 넓힌다).\n2. 그 후보가 **제외(E) 행에 걸리면** 최종 결과에서 빠진다.","category":"생략","severity":"높음","confidence":"확실","claim":"이 규칙만 따르면 포함 행 없이 제외 행만 입력했을 때는 최초 후보가 없다고 읽히지만, 뒤에서는 제외만 넣어도 동작한다고 말해 판정 원리를 이해할 수 없다.","evidence":"‘포함 행에서 후보를 만든 뒤 제외한다’는 2단계 설명에는 포함 행이 하나도 없는 경우의 출발 후보가 정의되지 않았다. 이후 흔한 실수 항목은 제외만 넣어도 동작한다고 결론만 제시하고, L07 과제도 ‘취소 제외(E)’를 요구한다. 여러 번 읽어도 제외 전용 조건이 왜 전체 값에서 C만 빼는 결과가 되는지 앞 내용으로 도출할 수 없다.","suggestion":"규칙에 ‘포함(I) 행이 하나도 없으면 모든 값이 우선 후보가 되고, 제외(E) 행에 맞는 값만 빠진다’를 별도 3번째 규칙과 간단한 예로 추가한다."},{"seq":2,"file":"C:\\SAP\\sap-dev-academy\\content\\abap\\CH12\\CH12-L05.md","quote":"| `NE` | 다름 | 사용 | 비움 | `I NE C001` |\n| `BT` | 사이(between) | 사용 | **사용** | `I BT C001 C003` |\n| `NB` | 사이 밖 | 사용 | 사용 | `I NB C001 C003` |","category":"과부하","severity":"중간","confidence":"확실","claim":"이번 레슨의 핵심을 EQ·BT·CP라고 한 직후, 설명하지 않을 OPTION까지 한꺼번에 제시해 초점이 흐려진다.","evidence":"표에는 EQ·BT·CP 외에도 NE·NB·GT·GE·LT·LE·NP가 새 기호로 동시에 등장한다. 입문자는 무엇을 외워야 하는지 판단하려고 표 전체에서 멈추게 되며, 뒤의 본문은 EQ·BT·CP만 자세히 다뤄 나머지 기호는 짧은 한국어 뜻 외에는 확인할 방법이 없다.","suggestion":"본문 표에는 EQ·BT·CP만 남기고 나머지는 ‘참고용 OPTION’ 접기 영역이나 레슨 끝의 별도 참고 표로 옮긴다."},{"seq":3,"file":"C:\\SAP\\sap-dev-academy\\content\\abap\\CH12\\CH12-L06.md","quote":"**배치 프로그램, 내부 호출, 기본 조건 보정, 권한에\n따른 자동 제한**처럼 화면 없이 조건을 만들어야 할 때가 있다.","category":"단절","severity":"중간","confidence":"확실","claim":"Range Table 직접 조작이 필요한 이유를 설명하는 첫 문장에서 네 가지 미설명 실무 상황이 연달아 등장한다.","evidence":"이 챕터의 앞 레슨에는 ‘배치 프로그램’, ‘내부 호출’, ‘기본 조건 보정’, ‘권한에 따른 자동 제한’의 뜻이나 구체적인 상황이 없다. 화면 없이 조건을 만든다는 핵심은 이해되지만, 각 표현이 어떤 상황인지 몰라 도입부에서 멈추게 된다.","suggestion":"하나의 쉬운 사례로 먼저 설명한다. 예를 들어 ‘사용자가 입력하지 않아도 회사 규칙상 취소 상태를 자동으로 빼야 할 때’라고 풀고, 나머지 실무 용어는 괄호 속 참고로 축소한다."}],"overall":{"grade_opinion":"보강 권장","summary":"핵심 흐름은 L01의 ‘사람 말 → 네 칸 행’과 ‘행 → 사람 말’ 표, 단계별 체험 장치 덕분에 잘 읽혔다. 다만 제외 행만 존재할 때의 판정 규칙은 후속 실습을 이해하는 데 필요한 핵심 단계가 빠져 있으며, L05·L06의 용어 묶음은 비전공 입문자에게 불필요한 과부하를 준다."}}